{
  "version": "v1",
  "trace_id": "trace_demo",
  "request_id": "req_demo",
  "model": "rerank_toy_v1",
  "task": "rerank",
  "pairs": [
    {
      "pair_id": "p1",
      "query": "harry potter",
      "doc": "TITLE: Harry Potter and the Philosopher's Stone",
      "doc_id": "b1",
      "features": {
        "lex_rank": 1,
        "vec_rank": 2,
        "rrf_score": 0.167,
        "issued_year": 1999,
        "volume": 1,
        "edition_labels": ["recover"]
      }
    }
  ],
  "options": {
    "timeout_ms": 200,
    "return_debug": true
  }
}
